{
  "schema_version": "agl.comparison-bindings.v1",
  "locked_at": "2026-07-10",
  "preregistration_sha256": "737d2a626b8d2fc37040ec6f5b0c6aef5283dbd49e41fe62a513eaf7ace6b848",
  "corpus_sha256": "b6edbe5a33e2a61a179d4bd322df069e5eea0f548606832d49461f68f19bf8de",
  "engine_sha256": "977aa4ffe1f04d4d07e5b578b50b6c7f1aae5fbcf51e9b5a7025f9deaae73744"
}
